{
  "id": "b4d08c16-a891-4186-884d-e469cba72e99",
  "editorScheme": {
    "type": "template",
    "name": "Doki Dark"
  },
  "overrides": {
    "editorScheme": {
      "colors": {}
    }
  },
  "ui": {
    "Doki.Icon.Accent.Contrast.color": "headerColor",
    "ActionButton.pressedBackground": "selectionBackgroundTransparent",
    "ActionButton.pressedBorderColor": "#00000000"
  }
}