{
  "id": "696de7c1-3a8e-4445-83ee-3eb7e9dca47f",
  "editorScheme": {
    "type": "templateExtension",
    "file": "Emilia_Dark.xml"
  },
  "overrides": {},
  "ui": {
    "Plugins.lightSelectionBackground": "selectionBackground",
    "CompletionPopup.selectionBackground": "selectionBackground",
    "SearchEverywhere.Header.background": "headerColor",
    "SearchEverywhere.SearchField.background": "headerColor",
    "List.selectionBackground": "#5d3b70"
  }
}